{
  "schemaVersion": "0.1",
  "units": "mm",
  "displayUnits": "imperial",
  "source": { "type": "manual" },
  "orientation": { "northAngleDeg": 0, "headingSource": "manual" },
  "defaults": { "region": "US", "interiorWallThickness": 114, "exteriorWallThickness": 165, "ceilingHeight": 2438 },
  "levels": [{
    "id": "L1", "name": "Main Floor", "elevation": 0, "floorToCeiling": 2438,
    "walls": [
      { "id": "W1", "start": { "x": 82.5,   "y": 82.5 },   "end": { "x": 5124.5, "y": 82.5 },   "thickness": 165, "isExterior": true },
      { "id": "W2", "start": { "x": 5124.5, "y": 82.5 },   "end": { "x": 5124.5, "y": 2685.5 }, "thickness": 165, "isExterior": true },
      { "id": "W3", "start": { "x": 5124.5, "y": 2685.5 }, "end": { "x": 2685.5, "y": 2685.5 }, "thickness": 165, "isExterior": true },
      { "id": "W4", "start": { "x": 2685.5, "y": 2685.5 }, "end": { "x": 2685.5, "y": 4514.5 }, "thickness": 165, "isExterior": true },
      { "id": "W5", "start": { "x": 2685.5, "y": 4514.5 }, "end": { "x": 82.5,   "y": 4514.5 }, "thickness": 165, "isExterior": true },
      { "id": "W6", "start": { "x": 82.5,   "y": 4514.5 }, "end": { "x": 82.5,   "y": 82.5 },   "thickness": 165, "isExterior": true }
    ],
    "openings": [
      { "id": "D1", "wallId": "W1", "type": "door", "offsetFromStart": 600, "width": 914, "height": 2032, "sillHeight": 0,
        "operation": "hinged", "swing": { "hingeEnd": "end", "openSide": "left" } },
      { "id": "N1", "wallId": "W2", "type": "window", "offsetFromStart": 850, "width": 914, "height": 1219, "sillHeight": 914, "operation": "double-hung" },
      { "id": "N2", "wallId": "W5", "type": "window", "offsetFromStart": 690, "width": 1219, "height": 1219, "sillHeight": 914, "operation": "double-hung" }
    ],
    "rooms": [
      { "id": "R1", "name": "Great Room", "type": "great-room", "boundaryWallIds": ["W1", "W2", "W3", "W4", "W5", "W6"], "ceilingHeight": 2743 }
    ]
  }]
}
